pid,creator,occupation,place,label,year,genre,rights,related_reference,pages,order,layout,collection,thumbnail,full,manifest
doc1,Lu Qingsheng and Jiang Zhenyuan,Cadre/Professional,Beijing,The Lu-Jiang Correspondence,1964-1966,letters,CCSLD,"Republished as Zhang Letian and Yunxiang Yan, eds, Personal Letters between Lu Qingsheng and Jiang Zhenyuan, 1961-1986 (Leiden: Brill, 2018); see also, Li Tian and Yan Yunxiang, ""Self-Cultivation of the Socialist New Person in Maoist China: Evidence from a Family’s Private Letters, 1961–1986,"" The China Journal 82 (2019): 88-110.",8,0,grassroots_item,gs,"/img/derivatives/iiif/images/doc1_196606263/full/250,/0/default.jpg",/img/derivatives/iiif/images/doc1_196606263/full/full/0/default.jpg,/img/derivatives/iiif/doc1/manifest.json
doc2,Zhang Ruirong,Intellectual (Researcher),Shanghai,The Letters of Zhang Ruirong,1964-1965,letters,CCSLD,"Xu Xiuli, ""Geming Niandai de Yinshi Ernü: Du Zhang Ruirong de Jiaxin"" Historical Monthly 4 (2017): 49-63.",12,1,grassroots_item,gs,"/img/derivatives/iiif/images/doc2_X13Y017_179/full/250,/0/default.jpg",/img/derivatives/iiif/images/doc2_X13Y017_179/full/full/0/default.jpg,/img/derivatives/iiif/doc2/manifest.json
doc3,Zhou Shengkang,Village Cadre,"Haining County, Zhejiang",The Work Jounal of Zhou Shenkang,1962,work journal,CCSLD,"Republished as Zhang Letian, Xi Fuqun and Yunxiang Yan, eds, Work Journals of Zhou Shengkang, 1961-1982 (Leiden: Brill 2018); see also: Zhang Letian, Gaobie Geming: Renmin Gongshe Yanjiu (Shanghai: Dongfang Chubanshe, 1998).",13,2,grassroots_item,gs,"/img/derivatives/iiif/images/doc3_2019-05-24 15.15.13_13/full/250,/0/default.jpg",/img/derivatives/iiif/images/doc3_2019-05-24 15.15.13_13/full/full/0/default.jpg,/img/derivatives/iiif/doc3/manifest.json
doc4,A Xinhua Bookstore Manager,Manager,Shanghai,A Bookstore Manager's Work Journal,1957-1958,work journal,CCSLD,,15,3,grassroots_item,gs,"/img/derivatives/iiif/images/doc4_2019-05-24 15.25.17_20/full/250,/0/default.jpg",/img/derivatives/iiif/images/doc4_2019-05-24 15.25.17_20/full/full/0/default.jpg,/img/derivatives/iiif/doc4/manifest.json
doc5,Shu Jialiang,Technician,Shanghai,The Diary of Shu Jialiang,1957-1958,diary,CCSLD,"Jeremy Brown, City versus Countryside in Maoist China (Cambridge: Cambridge Univ Press, 2012)",12,4,grassroots_item,gs,"/img/derivatives/iiif/images/doc5_001/full/250,/0/default.jpg",/img/derivatives/iiif/images/doc5_001/full/full/0/default.jpg,/img/derivatives/iiif/doc5/manifest.json
